{
  "schema_version": "1.0.0",
  "basemap_version": "0.1.0",
  "generated": "fixture",
  "image_root": {
    "kind": "bundled",
    "path": "data/map/maps"
  },
  "notes": ["契约夹具：覆盖 calibrated / approximate / unverified 三种状态"],
  "sources": {
    "src:fixture-a": {
      "url": "https://example.com/a",
      "fixed_revision": null,
      "accessed": "2026-10-19",
      "license": "fixture",
      "redistributable": "allowed",
      "method": "fixture",
      "review": "fixture"
    },
    "src:fixture-b": {
      "url": null,
      "fixed_revision": "rev-1",
      "accessed": null,
      "license": "fixture",
      "redistributable": "pending",
      "method": "fixture"
    }
  },
  "basemaps": {
    "bm:region_one/11": {
      "basemap_id": "bm:region_one/11",
      "version": "0.1.0",
      "region_id": "region_one",
      "unit_ids": [11],
      "map_path": "map\\unit_one",
      "level_drm": "unit_one",
      "source_sheet": "10001",
      "image": "maps/unit_one.webp",
      "image_width": 2048,
      "image_height": 2048,
      "transform": {
        "kind": "affine",
        "matrix": [2048.0, 0.0, 0.0, 0.0, 2048.0, 0.0],
        "coordinate_y_axis": "down",
        "image_origin": "top_left"
      },
      "transform_basis": "analytic",
      "status": "calibrated",
      "median_error_px": 4.0,
      "p95_error_px": 12.0,
      "max_error_px": 20.0,
      "error_source": "measured",
      "validation_samples": 38,
      "source_refs": ["src:fixture-a"],
      "image_sha256": "0000000000000000000000000000000000000000000000000000000000000001",
      "image_bytes": 123456,
      "review": {
        "state": "reviewed",
        "note": "fixture",
        "date": "2026-10-29"
      }
    },
    "bm:region_one/12": {
      "basemap_id": "bm:region_one/12",
      "version": "0.1.0",
      "region_id": "region_one",
      "unit_ids": [12],
      "image": "maps/unit_two.webp",
      "image_width": 1024,
      "image_height": 1024,
      "transform": {
        "kind": "affine",
        "matrix": [1024.0, 0.0, 0.0, 0.0, 1024.0, 0.0],
        "coordinate_y_axis": "down",
        "image_origin": "top_left"
      },
      "transform_basis": "analytic",
      "status": "approximate",
      "median_error_px": 10.0,
      "p95_error_px": 18.0,
      "max_error_px": 24.0,
      "error_source": "global_estimate",
      "validation_samples": 0,
      "source_refs": ["src:fixture-a", "src:fixture-b"],
      "image_sha256": "0000000000000000000000000000000000000000000000000000000000000002",
      "image_bytes": 65432,
      "review": {
        "state": "draft"
      }
    },
    "bm:unnamed/13": {
      "basemap_id": "bm:unnamed/13",
      "version": "0.1.0",
      "region_id": "unnamed",
      "unit_ids": [13],
      "image": "maps/unit_three.webp",
      "image_width": 512,
      "image_height": 512,
      "transform": {
        "kind": "affine",
        "matrix": [512.0, 0.0, 0.0, 0.0, 512.0, 0.0],
        "coordinate_y_axis": "down",
        "image_origin": "top_left"
      },
      "transform_basis": "analytic",
      "status": "unverified",
      "median_error_px": null,
      "p95_error_px": null,
      "max_error_px": null,
      "source_refs": ["src:fixture-b"],
      "image_sha256": "0000000000000000000000000000000000000000000000000000000000000003",
      "image_bytes": 2048,
      "review": {
        "state": "draft",
        "note": null,
        "date": null
      }
    }
  }
}
